<?xml version="1.0" encoding="utf-8"?>
<cnf:configuration xmlns:xsi="http://www.w3.org/2001/XMLSchema-instance" id="IFC4" xsi:schemaLocation="urn:iso:std:iso:10303:-28:ed-2:tech:XMLschema:configuration_language http://www.buildingsmart-tech.org/ifcXML/IFC4/P28/cnf.xsd" xmlns:cnf="urn:iso:std:iso:10303:-28:ed-2:tech:XMLschema:configuration_language">
  <cnf:option 
    inheritance="true" 
    concrete-attribute="attribute-content" 
    naming-convention="preserve-case" 
    generate-keys="false" />
  <cnf:schema targetNamespace="http://www.buildingsmart-tech.org/ifcXML/IFC4/final" elementFormDefault="qualified" attributeFormDefault="unqualified" embed-schema-items="true">
    <cnf:namespace prefix="ifc" alias="http://www.buildingsmart-tech.org/ifcXML/IFC4/final" />
  </cnf:schema>
  <cnf:uosElement name="ifcXML" />
  <cnf:type select="NUMBER" map="xs:double" />
  <cnf:type select="BINARY" map="xs:hexBinary" />
  <cnf:type select="IfcStrippedOptional" keep="false" />
  <cnf:entity select="IfcAnnotationFillArea">
    <cnf:attribute select="OuterBoundary" exp-attribute="attribute-tag" />
  </cnf:entity>
  <cnf:entity select="IfcApplication">
    <cnf:attribute select="ApplicationDeveloper" exp-attribute="attribute-tag" />
  </cnf:entity>
  <cnf:entity select="IfcAppliedValue">
    <cnf:attribute select="UnitBasis" exp-attribute="attribute-tag" />
  </cnf:entity>
  <cnf:entity select="IfcApprovalRelationship">
    <cnf:attribute select="RelatingApproval" exp-attribute="attribute-tag" />
  </cnf:entity>
  <cnf:entity select="IfcArbitraryClosedProfileDef">
    <cnf:attribute select="OuterCurve" exp-attribute="attribute-tag" />
  </cnf:entity>
  <cnf:entity select="IfcArbitraryOpenProfileDef">
    <cnf:attribute select="Curve" exp-attribute="attribute-tag" />
  </cnf:entity>
  <cnf:entity select="IfcAsset">
    <cnf:attribute select="OriginalValue" exp-attribute="attribute-tag" />
    <cnf:attribute select="CurrentValue" exp-attribute="attribute-tag" />
    <cnf:attribute select="TotalReplacementCost" exp-attribute="attribute-tag" />
    <cnf:attribute select="ResponsiblePerson" exp-attribute="attribute-tag" />
    <cnf:attribute select="DepreciatedValue" exp-attribute="attribute-tag" />
  </cnf:entity>
  <cnf:entity select="IfcAxis1Placement">
    <cnf:attribute select="Axis" exp-attribute="attribute-tag" />
  </cnf:entity>
  <cnf:entity select="IfcAxis2Placement2D">
    <cnf:attribute select="RefDirection" exp-attribute="attribute-tag" />
  </cnf:entity>
  <cnf:entity select="IfcAxis2Placement3D">
    <cnf:attribute select="Axis" exp-attribute="attribute-tag" />
    <cnf:attribute select="RefDirection" exp-attribute="attribute-tag" />
  </cnf:entity>
  <cnf:entity select="IfcBlobTexture">
    <cnf:attribute select="RasterCode" exp-attribute="attribute-tag" />
  </cnf:entity>
  <cnf:entity select="IfcBoundingBox">
    <cnf:attribute select="Corner" exp-attribute="attribute-tag" />
  </cnf:entity>
  <cnf:entity select="IfcBoxedHalfSpace">
    <cnf:attribute select="Enclosure" exp-attribute="attribute-tag" />
  </cnf:entity>
  <cnf:entity select="IfcBSplineSurface">
    <cnf:attribute select="ControlPointsList" exp-attribute="double-tag" />
  </cnf:entity>
  <cnf:entity select="IfcBuilding">
    <cnf:attribute select="BuildingAddress" exp-attribute="attribute-tag" />
  </cnf:entity>
  <cnf:entity select="IfcCartesianPointList3D">
    <cnf:attribute select="CoordList" exp-attribute="attribute-content" tagless="true" />
  </cnf:entity>
  <cnf:entity select="IfcCartesianTransformationOperator">
    <cnf:attribute select="Axis1" exp-attribute="attribute-tag" />
    <cnf:attribute select="Axis2" exp-attribute="attribute-tag" />
    <cnf:attribute select="LocalOrigin" exp-attribute="attribute-tag" />
  </cnf:entity>
  <cnf:entity select="IfcCartesianTransformationOperator3D">
    <cnf:attribute select="Axis3" exp-attribute="attribute-tag" />
  </cnf:entity>
  <cnf:entity select="IfcClassification">
    <cnf:attribute select="ReferenceTokens" exp-attribute="double-tag" />
    <cnf:inverse select="HasReferences" exp-attribute="double-tag" />
  </cnf:entity>
  <cnf:entity select="IfcClassificationReference">
    <cnf:attribute select="ReferencedSource" keep="false" />
    <cnf:inverse select="HasReferences" exp-attribute="double-tag" />
  </cnf:entity>
  <cnf:entity select="IfcColourRgbList">
    <cnf:attribute select="ColourList" exp-attribute="attribute-content" tagless="true" />
  </cnf:entity>
  <cnf:entity select="IfcCompositeCurveSegment">
    <cnf:attribute select="ParentCurve" exp-attribute="attribute-tag" />
  </cnf:entity>
  <cnf:entity select="IfcConstructionResource">
    <cnf:attribute select="Usage" exp-attribute="attribute-tag" />
    <cnf:attribute select="BaseQuantity" exp-attribute="attribute-tag" />
  </cnf:entity>
  <cnf:entity select="IfcConstructionResourceType">
    <cnf:attribute select="BaseQuantity" exp-attribute="attribute-tag" />
  </cnf:entity>
  <cnf:entity select="IfcContext">
    <cnf:attribute select="UnitsInContext" exp-attribute="attribute-tag" />
    <cnf:inverse select="IsDefinedBy" exp-attribute="double-tag" />
    <cnf:inverse select="Declares" exp-attribute="double-tag" />
  </cnf:entity>
  <cnf:entity select="IfcConversionBasedUnit">
    <cnf:attribute select="ConversionFactor" exp-attribute="attribute-tag" />
  </cnf:entity>
  <cnf:entity select="IfcCoordinateOperation">
    <cnf:attribute select="SourceCRS" keep="false" />
    <cnf:attribute select="TargetCRS" exp-attribute="attribute-tag" />
  </cnf:entity>
  <cnf:entity select="IfcCsgPrimitive3D">
    <cnf:attribute select="Position" exp-attribute="attribute-tag" />
  </cnf:entity>
  <cnf:entity select="IfcCurrencyRelationship">
    <cnf:attribute select="RelatingMonetaryUnit" exp-attribute="attribute-tag" />
    <cnf:attribute select="RelatedMonetaryUnit" exp-attribute="attribute-tag" />
    <cnf:attribute select="RateSource" exp-attribute="attribute-tag" />
  </cnf:entity>
  <cnf:entity select="IfcCurveBoundedPlane">
    <cnf:attribute select="BasisSurface" exp-attribute="attribute-tag" />
    <cnf:attribute select="OuterBoundary" exp-attribute="attribute-tag" />
  </cnf:entity>
  <cnf:entity select="IfcCurveBoundedSurface">
    <cnf:attribute select="BasisSurface" exp-attribute="attribute-tag" />
  </cnf:entity>
  <cnf:entity select="IfcDerivedProfileDef">
    <cnf:attribute select="ParentProfile" exp-attribute="attribute-tag" />
    <cnf:attribute select="Operator" exp-attribute="attribute-tag" />
  </cnf:entity>
  <cnf:entity select="IfcDerivedUnitElement">
    <cnf:attribute select="Unit" exp-attribute="attribute-tag" />
  </cnf:entity>
  <cnf:entity select="IfcDocumentInformationRelationship">
    <cnf:attribute select="RelatingDocument" exp-attribute="attribute-tag" />
  </cnf:entity>
  <cnf:entity select="IfcDocumentReference">
    <cnf:attribute select="ReferencedDocument" exp-attribute="attribute-tag" />
  </cnf:entity>
  <cnf:entity select="IfcDoorLiningProperties">
    <cnf:attribute select="ShapeAspectStyle" exp-attribute="attribute-tag" />
  </cnf:entity>
  <cnf:entity select="IfcDoorPanelProperties">
    <cnf:attribute select="ShapeAspectStyle" exp-attribute="attribute-tag" />
  </cnf:entity>
  <cnf:entity select="IfcEdge">
    <cnf:attribute select="EdgeStart" exp-attribute="attribute-tag" />
    <cnf:attribute select="EdgeEnd" exp-attribute="attribute-tag" />
  </cnf:entity>
  <cnf:entity select="IfcEdgeCurve">
    <cnf:attribute select="EdgeGeometry" exp-attribute="attribute-tag" />
  </cnf:entity>
  <cnf:entity select="IfcElementarySurface">
    <cnf:attribute select="Position" exp-attribute="attribute-tag" />
  </cnf:entity>
  <cnf:entity select="IfcEvent">
    <cnf:attribute select="EventOccurenceTime" exp-attribute="attribute-tag" />
  </cnf:entity>
  <cnf:entity select="IfcExternalReferenceRelationship">
    <cnf:attribute select="RelatingReference" exp-attribute="attribute-tag" />
  </cnf:entity>
  <cnf:entity select="IfcExtrudedAreaSolid">
    <cnf:attribute select="ExtrudedDirection" exp-attribute="attribute-tag" />
  </cnf:entity>
  <cnf:entity select="IfcExtrudedAreaSolidTapered">
    <cnf:attribute select="EndSweptArea" exp-attribute="attribute-tag" />
  </cnf:entity>
  <cnf:entity select="IfcFaceBound">
    <cnf:attribute select="Bound" exp-attribute="attribute-tag" />
  </cnf:entity>
  <cnf:entity select="IfcFaceSurface">
    <cnf:attribute select="FaceSurface" exp-attribute="attribute-tag" />
  </cnf:entity>
  <cnf:entity select="IfcFillAreaStyleHatching">
    <cnf:attribute select="HatchLineAppearance" exp-attribute="attribute-tag" />
    <cnf:attribute select="PointOfReferenceHatchLine" exp-attribute="attribute-tag" />
    <cnf:attribute select="PatternStart" exp-attribute="attribute-tag" />
  </cnf:entity>
  <cnf:entity select="IfcFixedReferenceSweptAreaSolid">
    <cnf:attribute select="Directrix" exp-attribute="attribute-tag" />
    <cnf:attribute select="FixedReference" exp-attribute="attribute-tag" />
  </cnf:entity>
  <cnf:entity select="IfcGeometricRepresentationContext">
    <cnf:attribute select="WorldCoordinateSystem" exp-attribute="double-tag" />
    <cnf:attribute select="TrueNorth" exp-attribute="attribute-tag" />
    <cnf:inverse select="HasSubContexts" exp-attribute="double-tag" />
    <cnf:inverse select="HasCoordinateOperation" exp-attribute="attribute-tag" />
  </cnf:entity>
  <cnf:entity select="IfcGeometricRepresentationSubContext">
    <cnf:attribute select="ParentContext" keep="false" />
  </cnf:entity>
  <cnf:entity select="IfcGridAxis">
    <cnf:attribute select="AxisCurve" exp-attribute="attribute-tag" />
  </cnf:entity>
  <cnf:entity select="IfcGridPlacement">
    <cnf:attribute select="PlacementLocation" exp-attribute="attribute-tag" />
  </cnf:entity>
  <cnf:entity select="IfcHalfSpaceSolid">
    <cnf:attribute select="BaseSurface" exp-attribute="attribute-tag" />
  </cnf:entity>
  <cnf:entity select="IfcIndexedColourMap">